<?xml version="1.0" encoding="UTF-8"?>

<ns0:jSmaTeP-Parser-Config  xmlns:xsi='http://www.w3.org/2001/XMLSchema-instance'
   xmlns:ns0='http://jsmatep.kardass.com/schema/jSmaTeP-Parser-Config'
   xsi:schemaLocation='http://jsmatep.kardass.com/schema/jSmaTeP-Parser-Config jSmaTeP-Parser-Config.xsd' version="1.1.0">

    <ns0:type>
        <ns0:variable-length max-record-length="29"></ns0:variable-length>
    </ns0:type>
    <ns0:value-object>com.kardass.jsmatep.parser.ImporterTestValueObject</ns0:value-object>
    <ns0:fields>
        <ns0:field name="a" bean-property-name="someOtherName" position="0" length="2" type="String"></ns0:field>
        <ns0:field name="aaa" position="0" length="10" type="String"></ns0:field>
        <ns0:field name="b" position="2" length="8" type="Date" format="yyyyMMdd"></ns0:field>
        <ns0:field name="c" position="10" length="3" type="Integer"></ns0:field>
        <ns0:field name="d" position="13" length="5" type="float"></ns0:field>
        <ns0:field name="e" position="18" length="5" type="Decimal"></ns0:field>
        <ns0:field name="f" position="23" length="1" type="String"></ns0:field>
        <ns0:field name="g" position="24" length="5" type="Decimal" format="3,2"></ns0:field>
    </ns0:fields>
</ns0:jSmaTeP-Parser-Config>
