<?xml version="1.0" encoding="UTF-8"?>

<ns0:jSmaTeP-Parser-Config  xmlns:xsi='http://www.w3.org/2001/XMLSchema-instance'
   xmlns:ns0='http://jsmatep.kardass.com/schema/jSmaTeP-Parser-Config'
   xsi:schemaLocation='http://jsmatep.kardass.com/schema/jSmaTeP-Parser-Config jSmaTeP-Parser-Config.xsd' 
   version="1.0.0">

    <ns0:type>
        <ns0:variable-length max-record-length="14"></ns0:variable-length>
    </ns0:type>
    <ns0:value-object>com.kardass.jsmatep.parser.setterlogic.SetterLogicTestValueObject</ns0:value-object>
    <ns0:fields>
        <ns0:field name="a" position="0" length="2" type="String"></ns0:field>
        <ns0:field name="b" position="2" length="8" type="Date" format="yyyyMMdd" null-value="00000000" default-value="99991231"></ns0:field>
        <ns0:field name="c" position="10" length="4" type="Integer" default-value="9999"></ns0:field>
    </ns0:fields>
</ns0:jSmaTeP-Parser-Config>
